{
  "name": "canvas-api-inspector",
  "status": "planned",
  "purpose": "Inspect live or fixture-backed Canvas objects and normalize them into compact JSON summaries.",
  "use_when": [
    "Course, module, assignment, quiz, rubric, user, or enrollment metadata is needed",
    "Relationships between Canvas objects matter",
    "Raw Canvas API responses are too large or noisy"
  ],
  "avoid_when": [
    "Live Canvas access is not available and no fixture is supplied",
    "The task only needs static documentation"
  ],
  "inputs": {
    "object_type": "Canvas object type such as course, module, assignment, quiz, rubric, user, or enrollment.",
    "object_id": "Canvas object ID when live lookup is used.",
    "fixture_path": "Optional fixture path for offline inspection."
  },
  "outputs": {
    "summary": "Normalized JSON summary of IDs, names, dates, and relationships.",
    "source": "Source endpoint or fixture path.",
    "retrieved_at": "Retrieval timestamp when live data is used."
  },
  "command": null,
  "source_of_truth": [
    "Canvas API responses",
    "Local fixtures",
    "api/README.md confirmed Canvas behavior"
  ],
  "notes": "Planned tool. Any live implementation must avoid logging tokens or student data and must preserve FERPA guardrails."
}
