{
  "name": "repo-indexer",
  "status": "planned",
  "purpose": "Summarize repo structure, routes, components, services, API clients, models, and tests into a compact architecture map.",
  "use_when": [
    "Discovering architecture",
    "Locating implementation points",
    "Finding call sites or imports",
    "Understanding project layout before making changes"
  ],
  "avoid_when": [
    "The needed file or symbol is already known",
    "The task only requires reading one small file"
  ],
  "inputs": {
    "scope": "Optional path, symbol, route, or topic to focus indexing.",
    "include_tests": "Optional boolean for whether test files should be included."
  },
  "outputs": {
    "files": "Compact list of relevant files and roles.",
    "symbols": "Relevant functions, classes, routes, or service entry points.",
    "tests": "Related test files or commands when known.",
    "commands": "Commands used to produce the summary."
  },
  "command": null,
  "source_of_truth": [
    "Repository filesystem",
    "README.md",
    "AGENTS.md",
    "docs/README.md"
  ],
  "notes": "Planned tool. Until implemented, use rg and targeted file reads to approximate this behavior."
}
