{
  "name": "change-risk-summarizer",
  "status": "planned",
  "purpose": "Summarize git diffs by changed files, changed functions, risk areas, and recommended verification.",
  "use_when": [
    "Reviewing large changes",
    "Preparing PRs",
    "Deciding which tests to run",
    "Assessing behavioral risk"
  ],
  "avoid_when": [
    "The diff is tiny and already visible",
    "The user asked for a specific file-level explanation"
  ],
  "inputs": {
    "base_ref": "Optional git base ref.",
    "paths": "Optional paths to limit diff analysis."
  },
  "outputs": {
    "changed_files": "List of changed files and change types.",
    "risk_notes": "Behavioral, schema, data, or safety risk notes.",
    "suggested_tests": "Recommended checks or test commands."
  },
  "command": null,
  "source_of_truth": [
    "git diff",
    "git status",
    "CLAUDE.md safety guardrails"
  ],
  "notes": "Planned tool. Until implemented, use git diff --stat, targeted diffs, and the guardrails in CLAUDE.md."
}
