{
  "name": "canvas-docs-scraper",
  "status": "planned",
  "purpose": "Fetch or search official Canvas LMS documentation and return compact endpoint summaries.",
  "use_when": [
    "Canvas API behavior is needed",
    "Endpoint paths, params, auth, pagination, or response shapes are needed",
    "Current official documentation should be verified"
  ],
  "avoid_when": [
    "The task only concerns local implementation",
    "The relevant official docs are already present in context"
  ],
  "inputs": {
    "query": "Canvas API topic, endpoint, or behavior to search.",
    "docs_url": "Optional official Canvas documentation URL."
  },
  "outputs": {
    "endpoints": "Matching endpoint paths and methods.",
    "params": "Required and optional params.",
    "response_shape": "Compact response summary.",
    "source_urls": "Official Canvas documentation URLs.",
    "retrieved_at": "Retrieval timestamp."
  },
  "command": null,
  "source_of_truth": [
    "Official Canvas LMS API documentation",
    "api/README.md confirmed live-probe notes"
  ],
  "notes": "Planned tool. Until implemented, verify Canvas API facts against official docs and preserve source URLs."
}
